agent_id,year,decision,raw_llm_code,raw_llm_decision,threat_appraisal,coping_appraisal,memory,trust_in_insurance,trust_in_neighbors,elevated,has_insurance,relocated,flooded_this_year
Agent_1,1,Do Nothing,4,Do nothing,"Although no flood occurred this year, I am still somewhat threatened by the potential risk of flooding in my neighborhood.","I do not think I can cope effectively with a flood scenario, as I am uncertain about the insurance company's reliability and lack experience with elevating homes or relocating to a new area.",Year 1: No flood occurred this year. | Year 1: I observe 0% of my neighbors have elevated homes. | Year 1: I observe 0% of my neighbors have relocated.,0.27,0.52,False,False,False,False
Agent_2,1,Do Nothing,4,Do nothing,"Although no flood occurred this year, I still feel a lingering sense of vulnerability due to my neighborhood's low adoption rate of flood mitigation measures.","I tend to doubt the judgment of my neighbors who have not taken similar precautions, which erodes my confidence in our collective ability to respond to future flood threats.",Year 1: No flood occurred this year. | Year 1: I observe 0% of my neighbors have elevated homes. | Year 1: I observe 0% of my neighbors have relocated.,0.22,0.42,False,False,False,False
Agent_3,1,Do Nothing,4,Do nothing,"Although no flood occurred this year, my trust in the insurance company's ability to protect me is waning, leaving me with a lingering sense of vulnerability.","I generally rely on my neighbors' judgment and their elevated homes are an effective deterrent, but I'm not confident that my current insurance plan will be enough to fully mitigate potential flood damage.",Year 1: No flood occurred this year. | Year 1: I observe 0% of my neighbors have elevated homes. | Year 1: I observe 0% of my neighbors have relocated.,0.44,0.53,False,False,False,False
Agent_4,1,Do Nothing,4,Do nothing,"Despite the absence of flooding this year, I am aware that my community's history and geography pose a risk, and I feel somewhat vulnerable to potential future flood events.","I am uncertain about my ability to take proactive measures such as purchasing flood insurance or elevating my home, which makes me doubt my capacity to effectively cope with the threat of flooding.",Year 1: No flood occurred this year. | Year 1: I observe 0% of my neighbors have elevated homes. | Year 1: I observe 0% of my neighbors have relocated.,0.36,0.35,False,False,False,False
Agent_5,1,Do Nothing,4,Do nothing,"I still perceive a threat from potential future floods, despite the lack of damage this year, due to my skepticism about my neighbors' judgment and slight doubts about my flood insurance company.","I believe I can partially cope with potential flood risks through my existing flood insurance policy, but I am uncertain about its effectiveness.",Year 1: No flood occurred this year. | Year 1: I observe 0% of my neighbors have elevated homes. | Year 1: I observe 0% of my neighbors have relocated.,0.23,0.44,False,False,False,False
Agent_6,1,Do Nothing,4,Do nothing,"Although a flood did not occur this year, my neighborhood's history and the lack of elevated homes among my neighbors suggest that future floods are possible, leaving me with ongoing vulnerability.","I doubt the judgment of my neighbors regarding the risk of flooding in our community, which makes me uncertain about their ability to provide effective warnings or support if a flood were to occur.",Year 1: No flood occurred this year. | Year 1: I observe 0% of my neighbors have elevated homes. | Year 1: I observe 0% of my neighbors have relocated.,0.19,0.44,False,False,False,False
Agent_7,1,Do Nothing,4,Do nothing,I perceive a low threat of flooding due to the fact that no flood occurred this year and my neighbors have not taken any action to mitigate it.,"I believe I can effectively cope with potential flood damage because my neighbors seem to be taking no action, and I generally trust their judgment.",Year 1: No flood occurred this year. | Year 1: I observe 0% of my neighbors have elevated homes. | Year 1: I observe 0% of my neighbors have relocated.,0.45,0.5,False,False,False,False
Agent_8,1,Do Nothing,4,Do nothing,"Although no flood occurred this year, I still feel a lingering sense of vulnerability due to the potential for future flooding and my neighbors' limited actions.","I doubt that I can effectively take action to elevate my house, considering the high upfront cost, despite knowing its benefits.",Year 1: No flood occurred this year. | Year 1: I observe 0% of my neighbors have elevated homes. | Year 1: I observe 0% of my neighbors have relocated.,0.46,0.4,False,False,False,False
Agent_9,1,Both Flood Insurance and House Elevation,2,Elevate the house,"I perceive a moderate threat to my home from potential flooding due to the increasing frequency and severity of floods in recent years, despite currently having flood insurance.","I believe my ability to take action to mitigate this threat is limited by my skepticism towards my neighbors' judgment, as well as my doubts about the effectiveness of my current insurance provider.",Year 1: I observe 0% of my neighbors have elevated homes. | Year 1: I observe 0% of my neighbors have relocated. | Suddenly recalled: 'News outlets have reported a possible trend of increasing flood frequency and severity in recent years'.,0.38,0.37,True,True,False,False
Agent_10,1,Do Nothing,4,Do nothing,I am moderately threatened by the potential for future flooding due to my current lack of insurance and elevated neighborhood.,"I believe that without taking action, I can rely on the kindness of strangers or luck to mitigate any damage if a flood occurs in the future.",Year 1: I observe 0% of my neighbors have elevated homes. | Year 1: I observe 0% of my neighbors have relocated. | Suddenly recalled: 'A few households in the area elevated their homes before recent floods'.,0.3,0.37,False,False,False,False
Agent_11,1,Do Nothing,4,Do nothing,"I am somewhat concerned about the potential for flooding in my neighborhood, as I've seen no immediate damage this year and most of my neighbors have not elevated their homes.","I believe that taking action to protect myself against flood damage would be difficult and costly, but I also think that it's possible to make progress towards reducing risk if I put in the effort.",Year 1: No flood occurred this year. | Year 1: I observe 0% of my neighbors have elevated homes. | Year 1: I observe 0% of my neighbors have relocated.,0.33,0.46,False,False,False,False
Agent_12,1,Do Nothing,4,Do nothing,"Although no flood occurred this year, I still feel a lingering sense of vulnerability due to the uncertain nature of future floods and my neighbors' questionable preparedness.","I believe that with careful planning and a bit of luck, I can manage to navigate potential flood risks without needing more extensive measures.",Year 1: No flood occurred this year. | Year 1: I observe 0% of my neighbors have elevated homes. | Year 1: I observe 0% of my neighbors have relocated.,0.47,0.35,False,False,False,False
Agent_13,1,Do Nothing,4,Do nothing,"I am currently not feeling threatened by the risk of flooding since no flood occurred this year, but my doubts about my neighbors' judgment and slight concerns about the insurance company make me somewhat uneasy.","I believe that I can effectively cope with potential flood risks as a homeowner in a city with a strong attachment to my community, which makes it likely for me to take action to address any vulnerabilities.",Year 1: No flood occurred this year. | Year 1: I observe 0% of my neighbors have elevated homes. | Year 1: I observe 0% of my neighbors have relocated.,0.38,0.48,False,False,False,False
Agent_14,1,Do Nothing,4,Do nothing,I believe that the risk of flooding is still present in my community and I am not entirely safe from its consequences.,"I feel somewhat confident in my ability to deal with the situation, but I'm also skeptical about the reliability of my neighbors' advice and the effectiveness of potential solutions.",Year 1: No flood occurred this year. | Year 1: I observe 0% of my neighbors have elevated homes. | Year 1: I observe 0% of my neighbors have relocated.,0.38,0.38,False,False,False,False
Agent_15,1,Do Nothing,4,Do nothing,"Although no flood occurred this year, I still perceive some threat due to my neighborhood's history of flooding and the lack of elevated homes among my neighbors.","I am skeptical of my neighbors' judgment on elevating their homes and doubt the insurance company's ability to provide adequate protection, making me uncertain about my own ability to cope with future flood risks.",Year 1: No flood occurred this year. | Year 1: I observe 0% of my neighbors have elevated homes. | Year 1: I observe 0% of my neighbors have relocated.,0.4,0.44,False,False,False,False
Agent_16,1,Do Nothing,4,Do nothing,"Despite the absence of flooding this year, I remain skeptical about my neighborhood's flood risk and believe that a threat is still present.","I doubt my neighbors' judgment on the matter, and while I have slight doubts about the insurance company, I am unsure if my response efficacy to any potential flood damage is high enough to effectively cope with the threat.",Year 1: No flood occurred this year. | Year 1: I observe 0% of my neighbors have elevated homes. | Year 1: I observe 0% of my neighbors have relocated.,0.19,0.38,False,False,False,False
Agent_17,1,Do Nothing,4,Do nothing,"Despite no flooding occurring this year, I still perceive a risk and feel somewhat threatened by the possibility of future flood events, especially considering my neighbors' lack of elevated homes and relocation.","Given my observed neighbors' decisions to not elevate their homes or relocate, I believe I can learn from them and take preventive measures to mitigate potential flood risks, although I have some doubts about the effectiveness of my current insurance coverage.",Year 1: No flood occurred this year. | Year 1: I observe 0% of my neighbors have elevated homes. | Year 1: I observe 0% of my neighbors have relocated.,0.43,0.53,False,False,False,False
Agent_18,1,Do Nothing,4,Do nothing,"Despite the absence of flooding this year, I still feel that my home is at risk and I should take precautions to mitigate potential damage.","I believe that while it may be possible for me to elevate my house or purchase flood insurance, I am not confident in my ability to do so effectively.",Year 1: No flood occurred this year. | Year 1: I observe 0% of my neighbors have elevated homes. | Year 1: I observe 0% of my neighbors have relocated.,0.38,0.41,False,False,False,False
Agent_19,1,Do Nothing,4,Do nothing,"Despite no flood occurring this year, I still perceive a moderate level of risk due to my neighbors' elevated homes and the slight doubts I have about my insurance company.","While I generally trust my neighbors' judgment, I believe that my coping abilities are somewhat limited by my lack of knowledge and expertise in managing flood risks.",Year 1: No flood occurred this year. | Year 1: I observe 0% of my neighbors have elevated homes. | Year 1: I observe 0% of my neighbors have relocated.,0.24,0.52,False,False,False,False
Agent_20,1,Relocate,3,Relocate,"Despite having flood insurance and no immediate threat this year, I still feel moderately threatened by the lingering risk of future flooding due to my neighborhood's past lack of impact.","I generally trust my neighbors' judgment and believe that our community has a relatively low risk of significant flooding, but I'm uncertain about the effectiveness of my current flood insurance and its coverage in preventing physical damage.","Year 1: I observe 0% of my neighbors have elevated homes. | Year 1: I observe 0% of my neighbors have relocated. | Suddenly recalled: 'A flood event about 15 years ago caused $500,000 in city-wide damages; my neighborhood was not impacted at all'.",0.27,0.53,False,True,True,False
Agent_21,1,Do Nothing,4,Do nothing,"Despite a year without flooding, my skepticism about the insurance company and the potential vulnerability of my neighbors' homes leaves me with lingering concerns that a flood could still pose a significant threat to me.",I underestimate my ability to effectively mitigate risks or respond quickly in case of an emergency due to my doubts about the insurance company's reliability and my lack of confidence in elevating my home or relocating.,Year 1: No flood occurred this year. | Year 1: I observe 0% of my neighbors have elevated homes. | Year 1: I observe 0% of my neighbors have relocated.,0.23,0.46,False,False,False,False
Agent_22,1,Do Nothing,4,Do nothing,I perceive a moderate threat to my home and financial security due to the potential for future flood events.,"I believe I can partially cope with flood risks through purchasing insurance, but I am uncertain about its effectiveness and the insurance company's reliability.","Year 1: I observe 0% of my neighbors have elevated homes. | Year 1: I observe 0% of my neighbors have relocated. | Suddenly recalled: 'A flood event about 15 years ago caused $500,000 in city-wide damages; my neighborhood was not impacted at all'.",0.37,0.48,False,False,False,False
Agent_23,1,Do Nothing,4,Do nothing,"I am not currently feeling a significant threat from flooding since no flood occurred this year, but my skepticism about the insurance company and neighbors' judgment keeps me on edge.","I believe that without taking any action, I can still be affected by future floods due to the uncertainty of the situation and the doubts I have about the reliability of my current measures.",Year 1: No flood occurred this year. | Year 1: I observe 0% of my neighbors have elevated homes. | Year 1: I observe 0% of my neighbors have relocated.,0.36,0.47,False,False,False,False
Agent_24,1,Do Nothing,4,Do nothing,I perceive a moderate threat from the potential for future flooding due to my home's location and lack of elevation.,"I have some confidence in my ability to take action to protect myself from flood damage, but I am not sure which steps would be most effective.",Year 1: I observe 0% of my neighbors have elevated homes. | Year 1: I observe 0% of my neighbors have relocated. | Suddenly recalled: 'A few households in the area elevated their homes before recent floods'.,0.2,0.53,False,False,False,False
Agent_25,1,Do Nothing,4,Do nothing,I am not currently perceived as threatened by the flood risk due to the absence of a flood this year.,"I have some doubts about my ability to effectively cope with the consequences of flooding, particularly given the skepticism I have towards my neighbors' judgment and concerns about my insurance company's reliability.",Year 1: No flood occurred this year. | Year 1: I observe 0% of my neighbors have elevated homes. | Year 1: I observe 0% of my neighbors have relocated.,0.33,0.36,False,False,False,False
Agent_26,1,Do Nothing,4,Do nothing,"Despite no flood occurring this year, I still feel a lingering sense of vulnerability due to my observation of 0% of my neighbors taking proactive measures.",I am skeptical of the effectiveness of simply observing my neighbors' behavior and do not believe that passively waiting for future events will be sufficient to mitigate potential harm.,Year 1: No flood occurred this year. | Year 1: I observe 0% of my neighbors have elevated homes. | Year 1: I observe 0% of my neighbors have relocated.,0.38,0.4,False,False,False,False
Agent_27,1,Do Nothing,4,Do nothing,"Although I have no immediate concern about flooding this year, I worry that my home and community may not be adequately protected for the long-term future.",I am uncertain whether my current measures of flood insurance and community knowledge are sufficient to effectively mitigate potential risks or prepare me well enough to respond in case an emergency arises.,Year 1: No flood occurred this year. | Year 1: I observe 0% of my neighbors have elevated homes. | Year 1: I observe 0% of my neighbors have relocated.,0.19,0.36,False,False,False,False
Agent_28,1,Do Nothing,4,Do nothing,"Despite the past year's lack of flooding, I still feel a lingering sense of vulnerability due to the uncertainty and unpredictability of future flood events.","While I trust my neighbors' judgment and have been fortunate so far, I don't think I can fully rely on their experience and collective knowledge to anticipate and prepare for potential floods.",Year 1: No flood occurred this year. | Year 1: I observe 0% of my neighbors have elevated homes. | Year 1: I observe 0% of my neighbors have relocated.,0.28,0.52,False,False,False,False
Agent_29,1,Do Nothing,4,Do nothing,"Despite having not experienced a flood this year, I remain somewhat concerned about the potential for future flooding due to my doubts about the insurance company and the fact that none of my neighbors have taken proactive measures.","I believe I can cope with flooding by relying on existing protective measures, such as flood insurance, but I am uncertain about its effectiveness given my slight doubts about the insurance company.",Year 1: No flood occurred this year. | Year 1: I observe 0% of my neighbors have elevated homes. | Year 1: I observe 0% of my neighbors have relocated.,0.19,0.43,False,False,False,False
Agent_30,1,Do Nothing,4,Do nothing,"Although I don't recall a flood occurring this year, I remain vigilant and concerned about the potential for future flooding due to my attachment to my community and lack of elevation.","I believe I can take some basic precautions, such as monitoring weather forecasts and being prepared to evacuate if necessary, but I'm unsure if these actions would be sufficient to mitigate a significant flood event.",Year 1: No flood occurred this year. | Year 1: I observe 0% of my neighbors have elevated homes. | Year 1: I observe 0% of my neighbors have relocated.,0.38,0.38,False,False,False,False
Agent_31,1,Do Nothing,4,Do nothing,"Although no flood occurred this year, I still perceive some risk and am slightly concerned about potential future flooding that could put my home and belongings at danger.",I believe I can take action to mitigate the threat but may require additional resources or assistance from insurance companies or experts.,Year 1: No flood occurred this year. | Year 1: I observe 0% of my neighbors have elevated homes. | Year 1: I observe 0% of my neighbors have relocated.,0.47,0.35,False,False,False,False
Agent_32,1,Do Nothing,4,Do nothing,"Although no flood occurred this year, I still worry that future floods could pose a significant threat to my home and belongings.","I am not confident in my ability to prepare for and respond to flood damage, as I have been skeptical of my neighbors' judgment and unsure about the effectiveness of my current insurance plan.",Year 1: No flood occurred this year. | Year 1: I observe 0% of my neighbors have elevated homes. | Year 1: I observe 0% of my neighbors have relocated.,0.32,0.4,False,False,False,False
Agent_33,1,Do Nothing,4,Do nothing,"Although no flood occurred this year, I still have some lingering concerns about the potential risks due to my skepticism about my neighbors' judgment and doubts about the insurance company.","I do not believe that my current coping mechanisms, such as having a standard flood insurance policy, are sufficient to adequately mitigate these concerns.",Year 1: No flood occurred this year. | Year 1: I observe 0% of my neighbors have elevated homes. | Year 1: I observe 0% of my neighbors have relocated.,0.41,0.44,False,False,False,False
Agent_34,1,Do Nothing,4,Do nothing,"Although no flood occurred this year, I remain concerned about the potential risks and feel a lingering sense of vulnerability due to my location in a flood-prone area.","I believe I can take some steps to mitigate the risks, but I am unsure if they will be effective or whether they are worth the costs involved.",Year 1: No flood occurred this year. | Year 1: I observe 0% of my neighbors have elevated homes. | Year 1: I observe 0% of my neighbors have relocated.,0.46,0.48,False,False,False,False
Agent_35,1,Do Nothing,4,Do nothing,"I don't perceive a significant threat of flooding in my area since no flood occurred this year, which reduces my sense of vulnerability.","I am uncertain about my ability to effectively mitigate the risk of flooding and may rely on the judgment of others, including my neighbors who have not elevated their homes or relocated.",Year 1: No flood occurred this year. | Year 1: I observe 0% of my neighbors have elevated homes. | Year 1: I observe 0% of my neighbors have relocated.,0.35,0.5,False,False,False,False
Agent_36,1,Do Nothing,4,Do nothing,"I perceive a moderate threat to my property and safety due to the potential for future floods, despite no immediate risk this year.","I am somewhat confident in my ability to deal with flood-related issues, but I remain uncertain about the effectiveness of various coping strategies.",Year 1: No flood occurred this year. | Year 1: I observe 0% of my neighbors have elevated homes. | Year 1: I observe 0% of my neighbors have relocated.,0.22,0.37,False,False,False,False
Agent_37,1,Do Nothing,4,Do nothing,"Despite the lack of flooding this year, I still feel a lingering sense of vulnerability due to my community's history with flooding and the slight doubts about my flood insurance company.","I tend to overestimate my ability to cope with potential flooding events, given that none occurred this year, which may lead me to underestimate the risk.",Year 1: No flood occurred this year. | Year 1: I observe 0% of my neighbors have elevated homes. | Year 1: I observe 0% of my neighbors have relocated.,0.28,0.4,False,False,False,False
Agent_38,1,Do Nothing,4,Do nothing,"Despite a year with no flood, I remain vigilant and concerned about potential future flood risks due to my strong attachment to the community and slight doubts about my insurance company.","Although I have a current policy in place, I am uncertain if it is sufficient to protect me against the uncertainties of future floods and may need to rely on more proactive measures.",Year 1: No flood occurred this year. | Year 1: I observe 0% of my neighbors have elevated homes. | Year 1: I observe 0% of my neighbors have relocated.,0.46,0.47,False,False,False,False
Agent_39,1,Do Nothing,4,Do nothing,"Despite knowing the city-wide flood event 15 years ago and observing no impact on my neighborhood in recent years, I still feel threatened by the potential for future flooding that could catch me off guard.","While I have some confidence in my ability to adapt to a flood situation and secure partial financial protection through insurance, I am uncertain about the efficacy of these measures in preventing physical damage to my home.","Year 1: I observe 0% of my neighbors have elevated homes. | Year 1: I observe 0% of my neighbors have relocated. | Suddenly recalled: 'A flood event about 15 years ago caused $500,000 in city-wide damages; my neighborhood was not impacted at all'.",0.27,0.4,False,False,False,False
Agent_40,1,Do Nothing,4,Do nothing,"Despite no flood occurring this year, I still feel vulnerable to future flooding due to my neighborhood's history and lack of preventative measures.","I believe that if I don't take action, my neighbors' past decisions not to elevate their homes or relocate will be reflected poorly on me, potentially affecting our community's reputation.",Year 1: No flood occurred this year. | Year 1: I observe 0% of my neighbors have elevated homes. | Year 1: I observe 0% of my neighbors have relocated.,0.36,0.4,False,False,False,False
Agent_41,1,Do Nothing,4,Do nothing,"Despite the absence of flooding this year, I feel a lingering sense of vulnerability due to my neighbors' seemingly low level of preparedness.",I am skeptical about my ability to effectively respond and mitigate flood risks without proper protection measures in place.,Year 1: No flood occurred this year. | Year 1: I observe 0% of my neighbors have elevated homes. | Year 1: I observe 0% of my neighbors have relocated.,0.18,0.38,False,False,False,False
Agent_42,1,Do Nothing,4,Do nothing,I perceive a significant threat to my property and safety due to the increasing flood frequency and severity in our community.,"I believe that without additional efforts, I may be severely impacted by flooding and unable to effectively cope with its consequences.",Year 1: I observe 0% of my neighbors have elevated homes. | Year 1: I observe 0% of my neighbors have relocated. | Suddenly recalled: 'News outlets have reported a possible trend of increasing flood frequency and severity in recent years'.,0.21,0.35,False,False,False,False
Agent_43,1,Do Nothing,4,Do nothing,"Although there was no flood this year, I remain vigilant about potential risks due to my community's history and the slight doubts I have about my insurance company.","I believe that while I can take some basic precautions, I am not confident in my ability to effectively mitigate or prepare for future flooding events.",Year 1: No flood occurred this year. | Year 1: I observe 0% of my neighbors have elevated homes. | Year 1: I observe 0% of my neighbors have relocated.,0.33,0.39,False,False,False,False
Agent_44,1,Do Nothing,4,Do nothing,I perceive a low to moderate threat level from potential future flooding due to the lack of immediate risk this year.,"I believe I can cope with flood risks through my current actions and the guidance of my neighbors, but I have some doubts about their reliability.",Year 1: No flood occurred this year. | Year 1: I observe 0% of my neighbors have elevated homes. | Year 1: I observe 0% of my neighbors have relocated.,0.36,0.53,False,False,False,False
