agent_id,year,decision,raw_llm_code,raw_llm_decision,threat_appraisal,coping_appraisal,memory,trust_in_insurance,trust_in_neighbors,elevated,has_insurance,relocated,flooded_this_year
Agent_74,2,Do Nothing,4,Do nothing,"Despite having slight doubts about the insurance company and being skeptical of my neighbors' judgment, I perceive a serious flood risk due to the recent reported delays in processing flood insurance claims and the elevated homes of 3% of my neighbors.","Given my skepticism towards others' recommendations and concerns about the insurance company, I struggle to trust that I can effectively cope or respond to potential flooding threats on my own.",Year 2: I observe 3% of my neighbors have elevated homes. | Year 2: I observe 2% of my neighbors have relocated. | Suddenly recalled: 'Some residents reported delays when processing their flood insurance claims'.,0.29,0.36,False,False,False,False
Agent_75,2,Do Nothing,4,Do nothing,"I perceive a low threat of flooding in the current year since no flood occurred, but this situation could change in the future.",I doubt my ability to take proactive measures due to skepticism about my neighbors' judgment and uncertainty about the effectiveness of flood insurance companies.,Year 2: No flood occurred this year. | Year 2: I observe 3% of my neighbors have elevated homes. | Year 2: I observe 2% of my neighbors have relocated.,0.44,0.45,False,False,False,False
Agent_76,2,Do Nothing,4,Do nothing,I am not currently perceived as threatened due to the fact that no flood occurred this year.,I do not believe that I have developed sufficient coping skills or strategies to effectively address potential flood risks and mitigate their consequences.,Year 2: No flood occurred this year. | Year 2: I observe 3% of my neighbors have elevated homes. | Year 2: I observe 2% of my neighbors have relocated.,0.44,0.38,False,False,False,False
Agent_77,2,Do Nothing,4,Do nothing,"I perceive a moderate risk of future flooding in my neighborhood, given the lack of recent experience and the fact that only a small percentage of my neighbors have elevated their homes.","I believe I can partially cope with flood risks by buying flood insurance, which may provide some financial protection, but I am skeptical about its effectiveness due to doubts about the insurance company.",Year 2: No flood occurred this year. | Year 2: I observe 3% of my neighbors have elevated homes. | Year 2: I observe 2% of my neighbors have relocated.,0.21,0.4,False,False,False,False
Agent_78,2,Do Nothing,4,Do nothing,"Although no flood occurred this year, my community's history suggests a higher likelihood of flooding in the future, leaving me with a sense of ongoing threat.","I doubt my neighbors' judgment on elevating their homes and relocating, which makes me question the effectiveness of these options in protecting me from potential damage.",Year 2: No flood occurred this year. | Year 2: I observe 3% of my neighbors have elevated homes. | Year 2: I observe 2% of my neighbors have relocated.,0.3,0.48,False,False,False,False
Agent_80,2,Only House Elevation,3,Do nothing,"Although I have a protective elevated home and current no immediate threat since no flood occurred this year, my skepticism about the insurance company's reliability and limited knowledge of neighbors' preparedness make me uneasy.","I'm fairly certain that with some planning and cautionary measures, I could mitigate any potential damage to my property if a flood were to occur.",Year 2: No flood occurred this year. | Year 2: I observe 2% of my neighbors have elevated homes. | Year 2: I observe 2% of my neighbors have relocated.,0.3,0.4,True,False,False,False
Agent_81,2,Do Nothing,4,Do nothing,I perceive a moderate threat to my home and neighborhood due to the recent recalled information about elevated homes in the area and the possibility of future floods.,"I believe that without additional measures, I may not be able to effectively cope with or act in response to flooding events, given the potential severity and vulnerability associated with it.",Year 2: I observe 3% of my neighbors have elevated homes. | Year 2: I observe 2% of my neighbors have relocated. | Suddenly recalled: 'A few households in the area elevated their homes before recent floods'.,0.22,0.4,False,False,False,False
Agent_82,2,Do Nothing,4,Do nothing,"Although no flood occurred this year, I still worry about the potential for flooding in the future and its impact on my home's value.","I think it's relatively easy to cope with minor flooding issues, but more severe damage might be difficult for me to deal with without proper support.",Year 2: No flood occurred this year. | Year 2: I observe 3% of my neighbors have elevated homes. | Year 2: I observe 2% of my neighbors have relocated.,0.34,0.43,False,False,False,False
Agent_83,2,Do Nothing,4,Do nothing,"Although there was no flood this year, I am concerned that future years may bring unexpected and severe consequences.","I believe I can adequately prepare for potential flooding with the right measures in place, but I remain uncertain about my ability to execute them effectively.",Year 2: No flood occurred this year. | Year 2: I observe 3% of my neighbors have elevated homes. | Year 2: I observe 2% of my neighbors have relocated.,0.36,0.34,False,False,False,False
Agent_84,2,Do Nothing,4,Do nothing,"Although there was no flood this year, my community's history and the presence of elevated homes among some neighbors suggest that I am still at risk of experiencing a flood in the future.","I believe I can cope with a flood situation by taking steps to prepare myself, but I'm not confident in my ability to respond effectively under pressure.",Year 2: No flood occurred this year. | Year 2: I observe 3% of my neighbors have elevated homes. | Year 2: I observe 2% of my neighbors have relocated.,0.23,0.44,False,False,False,False
Agent_85,2,Do Nothing,4,Do nothing,"Although no flood occurred this year, I still feel vulnerable to potential future flooding due to my location and the uncertainty surrounding the insurance company's reliability.","I believe that I can partially cope with the risk of flooding through flood insurance, but I am skeptical about its effectiveness given my doubts about the insurance company.",Year 2: No flood occurred this year. | Year 2: I observe 3% of my neighbors have elevated homes. | Year 2: I observe 2% of my neighbors have relocated.,0.29,0.4,False,False,False,False
Agent_86,2,Do Nothing,4,Do nothing,"Despite no flooding this year, I am still somewhat concerned about potential flood risks in the future and worry that my home might not be protected if disaster strikes.","I believe I can cope with flood-related challenges, but I also think I need a more proactive approach to protect myself and my property.",Year 2: No flood occurred this year. | Year 2: I observe 3% of my neighbors have elevated homes. | Year 2: I observe 2% of my neighbors have relocated.,0.31,0.38,False,False,False,False
Agent_87,2,Do Nothing,4,Do nothing,"I perceive a moderate threat to my property from potential future floods, despite the lack of occurrence this year.","I believe that without taking proactive measures, I can rely on the judgment and experience of my neighbors, who have taken steps to mitigate flood risk by elevating or relocating their homes.",Year 2: No flood occurred this year. | Year 2: I observe 3% of my neighbors have elevated homes. | Year 2: I observe 2% of my neighbors have relocated.,0.36,0.52,False,False,False,False
Agent_88,2,Do Nothing,4,Do nothing,I am moderately concerned that the risk of flooding is still present in my community due to the uncertainty surrounding the city's flood mitigation efforts.,"Unfortunately, I feel that I have limited resources and knowledge to effectively manage this risk, which may hinder my ability to take decisive action.",Year 2: I observe 3% of my neighbors have elevated homes. | Year 2: I observe 2% of my neighbors have relocated. | Suddenly recalled: 'The city previously introduced a program offering elevation support to residents'.,0.3,0.37,False,False,False,False
Agent_89,2,Do Nothing,4,Do nothing,"Despite the lack of flooding this year, I still worry that my home is vulnerable to future floods and that my neighborhood may not be doing enough to prepare for potential disasters.",I don't think I can effectively respond to a flood emergency or take adequate steps to protect my home without more knowledge and resources.,Year 2: No flood occurred this year. | Year 2: I observe 3% of my neighbors have elevated homes. | Year 2: I observe 2% of my neighbors have relocated.,0.18,0.34,False,False,False,False
Agent_90,2,Do Nothing,4,Do nothing,"I still worry about the possibility of a flood occurring in my neighborhood, despite no damage happening this year.","I doubt my ability to take effective action to protect myself from potential flooding, mainly because I'm not sure if the insurance company will provide adequate assistance or if elevating my house is feasible.",Year 2: No flood occurred this year. | Year 2: I observe 3% of my neighbors have elevated homes. | Year 2: I observe 2% of my neighbors have relocated.,0.17,0.43,False,False,False,False
Agent_91,2,Do Nothing,4,Do nothing,"Although I do not currently perceive an immediate threat due to the lack of flooding this year, my concerns about potential flood risks in the future and the vulnerability of my home lead me to consider that I could be affected.","I believe that I can take steps to protect myself from flood damage, but I may require some assistance or guidance from others, particularly due to doubts about the insurance company.",Year 2: No flood occurred this year. | Year 2: I observe 3% of my neighbors have elevated homes. | Year 2: I observe 2% of my neighbors have relocated.,0.32,0.52,False,False,False,False
Agent_92,2,Both Flood Insurance and House Elevation,2,Elevate the house,I perceive a moderate threat to my home and safety from potential future flooding events.,My confidence in my ability to effectively respond to and mitigate flood risks is relatively low due to the slight doubts about the insurance company and skepticism of my neighbors' judgment.,Year 2: I observe 3% of my neighbors have elevated homes. | Year 2: I observe 2% of my neighbors have relocated. | Suddenly recalled: 'News outlets have reported a possible trend of increasing flood frequency and severity in recent years'.,0.35,0.34,True,True,False,False
Agent_93,2,Do Nothing,4,Do nothing,"Although no flood occurred this year, I perceive a moderate threat due to the relatively high percentage of neighbors who have elevated their homes and my own awareness of the potential risks.",I generally trust my insurance company's judgment and believe that taking action to mitigate the risk will be manageable for me personally.,Year 2: No flood occurred this year. | Year 2: I observe 3% of my neighbors have elevated homes. | Year 2: I observe 2% of my neighbors have relocated.,0.48,0.5,False,False,False,False
Agent_94,2,Do Nothing,4,Do nothing,"I perceive myself as moderately vulnerable to flooding due to the recent recall that some households in my area elevated their homes before floods, and my neighbor's houses have already started with elevations.","I underestimate my ability to act effectively in response to potential flooding, partly because of my skepticism towards insurance companies and neighbors' judgment.",Year 2: I observe 3% of my neighbors have elevated homes. | Year 2: I observe 2% of my neighbors have relocated. | Suddenly recalled: 'A few households in the area elevated their homes before recent floods'.,0.45,0.48,False,False,False,False
Agent_95,2,Do Nothing,4,Do nothing,"Although there was no flood this year, I still harbor some concerns about the potential for future flooding due to my neighbors' experiences and the fact that elevated homes are becoming more common.","I believe that with some cautionary measures, I can effectively prepare myself to mitigate the effects of a potential flood.",Year 2: No flood occurred this year. | Year 2: I observe 3% of my neighbors have elevated homes. | Year 2: I observe 2% of my neighbors have relocated.,0.38,0.49,False,False,False,False
Agent_96,2,Do Nothing,4,Do nothing,"Although I don't anticipate a flood this year, the thought of being unprepared for future floods still poses a threat to my home and community.","However, I am uncertain about my ability to effectively respond to a flood, as I have doubts about my neighbors' judgment and the insurance company's reliability.",Year 2: No flood occurred this year. | Year 2: I observe 3% of my neighbors have elevated homes. | Year 2: I observe 2% of my neighbors have relocated.,0.39,0.34,False,False,False,False
Agent_97,2,Do Nothing,4,Do nothing,"I still perceive a risk of flooding in my community, despite the fact that no flood occurred this year, and I am not confident in my ability to elevate my home or relocate.","I do not believe I have the resources or confidence to implement elevation measures effectively, and relocating would require significant emotional and financial strain.",Year 2: No flood occurred this year. | Year 2: I observe 3% of my neighbors have elevated homes. | Year 2: I observe 2% of my neighbors have relocated.,0.18,0.34,False,False,False,False
Agent_98,2,Do Nothing,4,Do nothing,"Despite the lack of flooding this year, I worry that a flood could still occur in the future and severely impact my property and community.","I believe that without any preparedness measures, such as elevating my house or buying flood insurance, I may be at risk for significant financial losses if a flood occurs, which would strain my personal finances and potentially lead to increased stress.",Year 2: No flood occurred this year. | Year 2: I observe 3% of my neighbors have elevated homes. | Year 2: I observe 2% of my neighbors have relocated.,0.46,0.36,False,False,False,False
Agent_99,2,Do Nothing,4,Do nothing,I perceive a moderate threat from future flooding due to the elevated risk in my community and the potential for damage to my home.,"I am uncertain about my ability to cope with flood-related consequences, given the slight doubts about the insurance company's reliability and the lack of confidence in taking action.",Year 2: No flood occurred this year. | Year 2: I observe 3% of my neighbors have elevated homes. | Year 2: I observe 2% of my neighbors have relocated.,0.44,0.43,False,False,False,False
Agent_100,2,Do Nothing,4,Do nothing,"Although no flood occurred this year, I am still concerned about the potential risks and feel that my community's vulnerability to flooding is too high.","I believe that my ability to cope with a flood event is limited due to my lack of preparedness and resources, which makes me more susceptible to the negative consequences.",Year 2: No flood occurred this year. | Year 2: I observe 3% of my neighbors have elevated homes. | Year 2: I observe 2% of my neighbors have relocated.,0.44,0.47,False,False,False,False
Agent_20,2,Already relocated,,,N/A,N/A,,,,,,,
Agent_79,2,Already relocated,,,N/A,N/A,,,,,,,
Agent_2,3,Do Nothing,4,Do nothing,"I perceive a moderate threat from potential future floods, given my neighborhood's history and the recent recalled information about elevated homes.","I doubt my ability to effectively act in response to a flood, considering my skepticism of insurance companies and neighbors' judgment.",Year 3: I observe 7% of my neighbors have elevated homes. | Year 3: I observe 3% of my neighbors have relocated. | Suddenly recalled: 'A few households in the area elevated their homes before recent floods'.,0.18,0.4,False,False,False,False
Agent_3,3,Only Flood Insurance,1,Buy flood insurance,I perceive a moderate threat to my home and safety due to the remaining flood risks in my community.,"I believe I can partially mitigate the risk of flooding by buying insurance, but I am uncertain about its effectiveness and the likelihood of damage.",Year 3: Elevation grants are available. | Year 3: I observe 7% of my neighbors have elevated homes. | Year 3: I observe 3% of my neighbors have relocated.,0.44,0.51,False,True,False,False
Agent_4,3,Do Nothing,4,Do nothing,"I perceive a moderate threat of flooding due to the ongoing risk in my community, despite having observed that only a small percentage of neighbors have been affected.","I believe I can cope with flood risks by taking immediate action, but I am uncertain about the effectiveness of insurance companies and the ability of elevation measures to prevent damage.",Year 3: Elevation grants are available. | Year 3: I observe 7% of my neighbors have elevated homes. | Year 3: I observe 3% of my neighbors have relocated.,0.32,0.33,False,False,False,False
Agent_5,3,Do Nothing,4,Do nothing,"Although I have not experienced flooding in recent years, my skepticism about flood risks and doubts about the insurance company make me feel somewhat threatened by the potential for future flooding.","I believe that if I don't take action, my inability to cope with the consequences of flooding will be a significant source of stress and anxiety.",Year 3: Elevation grants are available. | Year 3: I observe 7% of my neighbors have elevated homes. | Year 3: I observe 3% of my neighbors have relocated.,0.19,0.42,False,False,False,False
Agent_6,3,Do Nothing,4,Do nothing,"Despite observing the low probability of my neighbors having a problem with flooding and not being elevated, I still feel that there is some risk to me because of past knowledge about elevation grants.","I do not trust insurance companies to provide adequate protection or care in this situation, which makes me think I may be on my own with any protection against future flood damage.",Year 3: Elevation grants are available. | Year 3: I observe 7% of my neighbors have elevated homes. | Year 3: I observe 3% of my neighbors have relocated.,0.15,0.42,False,False,False,False
Agent_7,3,Do Nothing,4,Do nothing,"I feel moderately threatened by the potential flood risks in my community, as I am aware that even a small percentage of neighbors have experienced flooding and some have relocated due to it.","I believe I can cope with the flood risk through taking some action to mitigate its impact, but I may not be effective or confident in doing so.",Year 3: Elevation grants are available. | Year 3: I observe 7% of my neighbors have elevated homes. | Year 3: I observe 3% of my neighbors have relocated.,0.41,0.48,False,False,False,False
Agent_8,3,Both Flood Insurance and House Elevation,1,Buy flood insurance,"Despite my elevated home and the initial safety it provides, I am still uncertain about the likelihood and severity of future floods, leaving me with an ongoing sense of vulnerability.","While I have a strong attachment to my community and may feel skeptical of my neighbors' judgment on flood insurance, I believe that purchasing flood insurance would provide some level of financial protection against physical damage.",Year 3: Elevation grants are available. | Year 3: I observe 6% of my neighbors have elevated homes. | Year 3: I observe 3% of my neighbors have relocated.,0.46,0.38,True,True,False,False
Agent_9,3,Relocate,2,Relocate,"I perceive a moderate threat to my home and property from future floods, despite the elevated elevation, which has already shown some effectiveness in protecting neighbors.","I believe that I could take actions to mitigate flood damage if needed, but I am unsure about the effectiveness of those measures and whether I can actually implement them when necessary.",Year 3: I observe 6% of my neighbors have elevated homes. | Year 3: I observe 3% of my neighbors have relocated. | Suddenly recalled: 'A few households in the area elevated their homes before recent floods'.,0.34,0.35,True,False,True,False
Agent_10,3,Do Nothing,4,Do nothing,I perceive a moderate threat to my home and safety due to the possibility of future flooding.,"I am skeptical about my ability to effectively manage flood risks, given concerns about insurance company reliability and neighbors' judgment.",Year 3: Elevation grants are available. | Year 3: I observe 7% of my neighbors have elevated homes. | Year 3: I observe 3% of my neighbors have relocated.,0.26,0.35,False,False,False,False
Agent_11,3,Do Nothing,4,Do nothing,I am moderately concerned about the potential flooding due to my neighborhood's vulnerability and the uncertainty surrounding flood insurance.,I am uncertain whether my ability to cope with flooding is adequate due to limited knowledge about flood insurance and skepticism towards the neighbors' relocation decision.,Year 3: Elevation grants are available. | Year 3: I observe 7% of my neighbors have elevated homes. | Year 3: I observe 3% of my neighbors have relocated.,0.29,0.44,False,False,False,False
Agent_12,3,Do Nothing,4,Do nothing,"Despite seeing that 7% of my neighbors have elevated homes and I'm aware of the available elevation grants, I still feel somewhat threatened by the flood risks due to my lack of current insurance.","I'm skeptical of the effectiveness of both flood insurance and elevating my house, as well as my own ability to navigate the complexities of flood insurance and potentially facing financial difficulties if an elevation grant is not successful.",Year 3: Elevation grants are available. | Year 3: I observe 7% of my neighbors have elevated homes. | Year 3: I observe 3% of my neighbors have relocated.,0.43,0.33,False,False,False,False
Agent_13,3,Do Nothing,4,Do nothing,"I perceive a moderate level of threat from the potential for future flooding, as my community's flood risk is still present and not entirely mitigated by my neighbors' actions.","My coping skills and ability to take action are limited due to my skepticism of the insurance company and concerns about my neighbors' judgment, which may hinder my willingness to invest in measures to mitigate the flood risk.",Year 3: Elevation grants are available. | Year 3: I observe 7% of my neighbors have elevated homes. | Year 3: I observe 3% of my neighbors have relocated.,0.34,0.46,False,False,False,False
Agent_14,3,Do Nothing,4,Do nothing,I am moderately threatened by the potential for future flooding due to my location in a flood-prone area and lack of elevation.,"I believe that I can cope with the risk of flooding if it occurs, but my confidence is somewhat diminished by my skepticism towards insurance companies and my neighbors' judgment.",Year 3: Elevation grants are available. | Year 3: I observe 7% of my neighbors have elevated homes. | Year 3: I observe 3% of my neighbors have relocated.,0.34,0.36,False,False,False,False
Agent_15,3,Only Flood Insurance,1,Buy flood insurance,I perceive a moderate threat to my home and property due to the potential risks of flooding in my neighborhood.,"I am moderately confident in my ability to cope with flood-related threats, given that I have no experience with elevation grants and relocation is not currently an option for me.",Year 3: Elevation grants are available. | Year 3: I observe 7% of my neighbors have elevated homes. | Year 3: I observe 3% of my neighbors have relocated.,0.4,0.42,False,True,False,False
Agent_16,3,Do Nothing,4,Do nothing,I am moderately concerned about my vulnerability to flooding due to the lack of flood insurance and the uncertainty surrounding the effectiveness of it.,"I believe that I can cope with potential flooding consequences because I have not experienced any major issues in the past, but this perception is undermined by my distrust of the insurance company and skepticism towards my neighbors' judgment.",Year 3: Elevation grants are available. | Year 3: I observe 7% of my neighbors have elevated homes. | Year 3: I observe 3% of my neighbors have relocated.,0.15,0.36,False,False,False,False
Agent_17,3,Only Flood Insurance,1,Buy flood insurance,"I perceive a moderate level of threat from potential future floods, given my neighbor's experience with elevated homes and the insurance company's reliability.","I believe that if I take action, it will be challenging to cope effectively due to financial constraints and potential emotional distress associated with the upfront costs of elevation or relocation.",Year 3: Elevation grants are available. | Year 3: I observe 7% of my neighbors have elevated homes. | Year 3: I observe 3% of my neighbors have relocated.,0.43,0.51,False,True,False,False
Agent_18,3,Do Nothing,4,Do nothing,I perceive a moderate threat to my home and community due to the potential for future flooding.,I doubt my ability to effectively prepare for or respond to flood damage despite having access to information about elevation grants and insurance options.,Year 3: Elevation grants are available. | Year 3: I observe 7% of my neighbors have elevated homes. | Year 3: I observe 3% of my neighbors have relocated.,0.34,0.39,False,False,False,False
Agent_19,3,Only House Elevation,2,Elevate the house,"Although I currently do not have a flooded home, the risk of flooding remains a concern in my community.","I believe that with some preparation and planning, I can take steps to mitigate the flood risks and protect myself from potential future damage.",Year 3: Elevation grants are available. | Year 3: I observe 7% of my neighbors have elevated homes. | Year 3: I observe 3% of my neighbors have relocated.,0.2,0.5,True,False,False,False
